    1 0.000000000 fe80::a22:85a0:d2a7:f3b9 → ff02::2      ICMPv6 48 Router Solicitation
    2 0.000620700 169.254.144.9 → 169.254.144.1 TCP 40 19889 → 17998 [SYN] Seq=0 Win=0 Len=0
    3 0.000633100 169.254.144.1 → 169.254.144.9 TCP 44 17998 → 19889 [SYN, ACK] Seq=0 Ack=1 Win=64240 Len=0 MSS=1460
    4 0.000959000 169.254.144.9 → 169.254.144.1 TCP 40 [TCP Previous segment not captured] 19889 → 17998 [ACK] Seq=1520339172 Ack=1 Win=8192 Len=0
    5 0.000967100 169.254.144.1 → 169.254.144.9 TCP 40 [TCP Dup ACK 3#1] 17998 → 19889 [ACK] Seq=1 Ack=1 Win=64240 Len=0
    6 0.003056700 169.254.144.9 → 169.254.144.1 TCP 1040 19889 → 17998 [ACK] Seq=1 Ack=1 Win=8192 Len=1000
    7 0.003066200 169.254.144.1 → 169.254.144.9 TCP 40 17998 → 19889 [ACK] Seq=1 Ack=1001 Win=64000 Len=0
    8 0.003089900 169.254.144.9 → 169.254.144.1 TCP 1040 19889 → 17998 [ACK] Seq=1001 Ack=1 Win=8192 Len=1000
    9 0.003094200 169.254.144.1 → 169.254.144.9 TCP 40 17998 → 19889 [ACK] Seq=1 Ack=2001 Win=63000 Len=0
   10 0.003100600 169.254.144.9 → 169.254.144.1 TCP 1040 [TCP Previous segment not captured] 19889 → 17998 [ACK] Seq=3001 Ack=1 Win=8192 Len=1000
   11 0.003102100 169.254.144.1 → 169.254.144.9 TCP 40 [TCP Dup ACK 9#1] 17998 → 19889 [ACK] Seq=1 Ack=2001 Win=63000 Len=0
   12 0.003107800 169.254.144.9 → 169.254.144.1 TCP 1040 19889 → 17998 [ACK] Seq=4001 Ack=1 Win=8192 Len=1000
   13 0.003108900 169.254.144.1 → 169.254.144.9 TCP 40 [TCP Dup ACK 9#2] 17998 → 19889 [ACK] Seq=1 Ack=2001 Win=63000 Len=0
   14 0.003114500 169.254.144.9 → 169.254.144.1 TCP 1040 19889 → 17998 [ACK] Seq=5001 Ack=1 Win=8192 Len=1000
   15 0.003115500 169.254.144.1 → 169.254.144.9 TCP 40 [TCP Dup ACK 9#3] 17998 → 19889 [ACK] Seq=1 Ack=2001 Win=63000 Len=0
   16 0.003120800 169.254.144.9 → 169.254.144.1 TCP 1040 19889 → 17998 [ACK] Seq=6001 Ack=1 Win=8192 Len=1000
   17 0.003121800 169.254.144.1 → 169.254.144.9 TCP 40 [TCP Dup ACK 9#4] 17998 → 19889 [ACK] Seq=1 Ack=2001 Win=63000 Len=0
   18 0.003127100 169.254.144.9 → 169.254.144.1 TCP 1040 19889 → 17998 [ACK] Seq=7001 Ack=1 Win=8192 Len=1000
   19 0.003128000 169.254.144.1 → 169.254.144.9 TCP 40 [TCP Dup ACK 9#5] 17998 → 19889 [ACK] Seq=1 Ack=2001 Win=63000 Len=0
   20 0.003133400 169.254.144.9 → 169.254.144.1 TCP 1040 19889 → 17998 [ACK] Seq=8001 Ack=1 Win=8192 Len=1000
   21 0.003134600 169.254.144.1 → 169.254.144.9 TCP 40 [TCP Dup ACK 9#6] 17998 → 19889 [ACK] Seq=1 Ack=2001 Win=63000 Len=0
   22 0.003139800 169.254.144.9 → 169.254.144.1 TCP 1040 19889 → 17998 [ACK] Seq=9001 Ack=1 Win=8192 Len=1000
   23 0.003140900 169.254.144.1 → 169.254.144.9 TCP 40 [TCP Dup ACK 9#7] 17998 → 19889 [ACK] Seq=1 Ack=2001 Win=63000 Len=0
   24 0.003146200 169.254.144.9 → 169.254.144.1 TCP 1040 19889 → 17998 [ACK] Seq=10001 Ack=1 Win=8192 Len=1000
   25 0.003147400 169.254.144.1 → 169.254.144.9 TCP 40 [TCP Dup ACK 9#8] 17998 → 19889 [ACK] Seq=1 Ack=2001 Win=63000 Len=0
   26 0.003153000 169.254.144.9 → 169.254.144.1 TCP 1040 [TCP Previous segment not captured] 19889 → 17998 [ACK] Seq=12001 Ack=1 Win=8192 Len=1000
   27 0.003154000 169.254.144.1 → 169.254.144.9 TCP 40 [TCP Dup ACK 9#9] 17998 → 19889 [ACK] Seq=1 Ack=2001 Win=63000 Len=0
   28 0.003159500 169.254.144.9 → 169.254.144.1 TCP 1040 19889 → 17998 [ACK] Seq=13001 Ack=1 Win=8192 Len=1000
   29 0.003160500 169.254.144.1 → 169.254.144.9 TCP 40 [TCP Dup ACK 9#10] 17998 → 19889 [ACK] Seq=1 Ack=2001 Win=63000 Len=0
   30 0.003165900 169.254.144.9 → 169.254.144.1 TCP 1040 19889 → 17998 [ACK] Seq=14001 Ack=1 Win=8192 Len=1000
   31 0.003167000 169.254.144.1 → 169.254.144.9 TCP 40 [TCP Dup ACK 9#11] 17998 → 19889 [ACK] Seq=1 Ack=2001 Win=63000 Len=0
   32 0.003172200 169.254.144.9 → 169.254.144.1 TCP 1040 19889 → 17998 [ACK] Seq=15001 Ack=1 Win=8192 Len=1000
   33 0.003173200 169.254.144.1 → 169.254.144.9 TCP 40 [TCP Dup ACK 9#12] 17998 → 19889 [ACK] Seq=1 Ack=2001 Win=63000 Len=0
   34 0.003178500 169.254.144.9 → 169.254.144.1 TCP 1040 19889 → 17998 [ACK] Seq=16001 Ack=1 Win=8192 Len=1000
   35 0.003179400 169.254.144.1 → 169.254.144.9 TCP 40 [TCP Dup ACK 9#13] 17998 → 19889 [ACK] Seq=1 Ack=2001 Win=63000 Len=0
   36 0.003184600 169.254.144.9 → 169.254.144.1 TCP 1040 19889 → 17998 [ACK] Seq=17001 Ack=1 Win=8192 Len=1000
   37 0.003186200 169.254.144.1 → 169.254.144.9 TCP 40 [TCP Dup ACK 9#14] 17998 → 19889 [ACK] Seq=1 Ack=2001 Win=63000 Len=0
   38 0.003191500 169.254.144.9 → 169.254.144.1 TCP 1040 19889 → 17998 [ACK] Seq=18001 Ack=1 Win=8192 Len=1000
   39 0.003192800 169.254.144.1 → 169.254.144.9 TCP 40 [TCP Dup ACK 9#15] 17998 → 19889 [ACK] Seq=1 Ack=2001 Win=63000 Len=0
   40 0.003198200 169.254.144.9 → 169.254.144.1 TCP 1040 [TCP Previous segment not captured] 19889 → 17998 [ACK] Seq=21001 Ack=1 Win=8192 Len=1000
   41 0.003199400 169.254.144.1 → 169.254.144.9 TCP 40 [TCP Dup ACK 9#16] 17998 → 19889 [ACK] Seq=1 Ack=2001 Win=63000 Len=0
   42 0.003204600 169.254.144.9 → 169.254.144.1 TCP 1040 19889 → 17998 [ACK] Seq=22001 Ack=1 Win=8192 Len=1000
   43 0.003205600 169.254.144.1 → 169.254.144.9 TCP 40 [TCP Dup ACK 9#17] 17998 → 19889 [ACK] Seq=1 Ack=2001 Win=63000 Len=0
   44 0.003210800 169.254.144.9 → 169.254.144.1 TCP 1040 19889 → 17998 [ACK] Seq=23001 Ack=1 Win=8192 Len=1000
   45 0.003211700 169.254.144.1 → 169.254.144.9 TCP 40 [TCP Dup ACK 9#18] 17998 → 19889 [ACK] Seq=1 Ack=2001 Win=63000 Len=0
   46 0.003216900 169.254.144.9 → 169.254.144.1 TCP 1040 19889 → 17998 [ACK] Seq=24001 Ack=1 Win=8192 Len=1000
   47 0.003218000 169.254.144.1 → 169.254.144.9 TCP 40 [TCP Dup ACK 9#19] 17998 → 19889 [ACK] Seq=1 Ack=2001 Win=63000 Len=0
   48 0.003223300 169.254.144.9 → 169.254.144.1 TCP 1040 19889 → 17998 [ACK] Seq=25001 Ack=1 Win=8192 Len=1000
   49 0.003224200 169.254.144.1 → 169.254.144.9 TCP 40 [TCP Dup ACK 9#20] 17998 → 19889 [ACK] Seq=1 Ack=2001 Win=63000 Len=0
   50 0.003229300 169.254.144.9 → 169.254.144.1 TCP 1040 19889 → 17998 [ACK] Seq=26001 Ack=1 Win=8192 Len=1000
   51 0.003230200 169.254.144.1 → 169.254.144.9 TCP 40 [TCP Dup ACK 9#21] 17998 → 19889 [ACK] Seq=1 Ack=2001 Win=63000 Len=0
   52 0.003235500 169.254.144.9 → 169.254.144.1 TCP 1040 19889 → 17998 [ACK] Seq=27001 Ack=1 Win=8192 Len=1000
   53 0.003236700 169.254.144.1 → 169.254.144.9 TCP 40 [TCP Dup ACK 9#22] 17998 → 19889 [ACK] Seq=1 Ack=2001 Win=63000 Len=0
   54 0.003242700 169.254.144.9 → 169.254.144.1 TCP 1040 [TCP Previous segment not captured] 19889 → 17998 [ACK] Seq=29001 Ack=1 Win=8192 Len=1000
   55 0.003243800 169.254.144.1 → 169.254.144.9 TCP 40 [TCP Dup ACK 9#23] 17998 → 19889 [ACK] Seq=1 Ack=2001 Win=63000 Len=0
   56 0.003249300 169.254.144.9 → 169.254.144.1 TCP 1040 19889 → 17998 [ACK] Seq=30001 Ack=1 Win=8192 Len=1000
   57 0.003250400 169.254.144.1 → 169.254.144.9 TCP 40 [TCP Dup ACK 9#24] 17998 → 19889 [ACK] Seq=1 Ack=2001 Win=63000 Len=0
   58 0.003255800 169.254.144.9 → 169.254.144.1 TCP 1040 19889 → 17998 [ACK] Seq=31001 Ack=1 Win=8192 Len=1000
   59 0.003256700 169.254.144.1 → 169.254.144.9 TCP 40 [TCP Dup ACK 9#25] 17998 → 19889 [ACK] Seq=1 Ack=2001 Win=63000 Len=0
   60 0.003262400 169.254.144.9 → 169.254.144.1 TCP 1040 19889 → 17998 [ACK] Seq=32001 Ack=1 Win=8192 Len=1000
   61 0.003263400 169.254.144.1 → 169.254.144.9 TCP 40 [TCP Dup ACK 9#26] 17998 → 19889 [ACK] Seq=1 Ack=2001 Win=63000 Len=0
   62 0.003268700 169.254.144.9 → 169.254.144.1 TCP 1040 19889 → 17998 [ACK] Seq=33001 Ack=1 Win=8192 Len=1000
   63 0.003269700 169.254.144.1 → 169.254.144.9 TCP 40 [TCP Dup ACK 9#27] 17998 → 19889 [ACK] Seq=1 Ack=2001 Win=63000 Len=0
   64 0.003275600 169.254.144.9 → 169.254.144.1 TCP 1040 19889 → 17998 [ACK] Seq=34001 Ack=1 Win=8192 Len=1000
   65 0.003276500 169.254.144.1 → 169.254.144.9 TCP 40 [TCP Dup ACK 9#28] 17998 → 19889 [ACK] Seq=1 Ack=2001 Win=63000 Len=0
   66 0.003282200 169.254.144.9 → 169.254.144.1 TCP 1040 19889 → 17998 [ACK] Seq=35001 Ack=1 Win=8192 Len=1000
   67 0.003283100 169.254.144.1 → 169.254.144.9 TCP 40 [TCP Dup ACK 9#29] 17998 → 19889 [ACK] Seq=1 Ack=2001 Win=63000 Len=0
   68 0.003288600 169.254.144.9 → 169.254.144.1 TCP 1040 19889 → 17998 [ACK] Seq=36001 Ack=1 Win=8192 Len=1000
   69 0.003289800 169.254.144.1 → 169.254.144.9 TCP 40 [TCP Dup ACK 9#30] 17998 → 19889 [ACK] Seq=1 Ack=2001 Win=63000 Len=0
   70 0.003295700 169.254.144.9 → 169.254.144.1 TCP 1040 19889 → 17998 [ACK] Seq=37001 Ack=1 Win=8192 Len=1000
   71 0.003296900 169.254.144.1 → 169.254.144.9 TCP 40 [TCP Dup ACK 9#31] 17998 → 19889 [ACK] Seq=1 Ack=2001 Win=63000 Len=0
   72 0.003302300 169.254.144.9 → 169.254.144.1 TCP 1040 19889 → 17998 [ACK] Seq=38001 Ack=1 Win=8192 Len=1000
   73 0.003303300 169.254.144.1 → 169.254.144.9 TCP 40 [TCP Dup ACK 9#32] 17998 → 19889 [ACK] Seq=1 Ack=2001 Win=63000 Len=0
   74 0.003309100 169.254.144.9 → 169.254.144.1 TCP 1040 19889 → 17998 [ACK] Seq=39001 Ack=1 Win=8192 Len=1000
   75 0.003310000 169.254.144.1 → 169.254.144.9 TCP 40 [TCP Dup ACK 9#33] 17998 → 19889 [ACK] Seq=1 Ack=2001 Win=63000 Len=0
   76 0.003315300 169.254.144.9 → 169.254.144.1 TCP 1040 19889 → 17998 [ACK] Seq=40001 Ack=1 Win=8192 Len=1000
   77 0.003316300 169.254.144.1 → 169.254.144.9 TCP 40 [TCP Dup ACK 9#34] 17998 → 19889 [ACK] Seq=1 Ack=2001 Win=63000 Len=0
   78 0.003321500 169.254.144.9 → 169.254.144.1 TCP 1040 19889 → 17998 [ACK] Seq=41001 Ack=1 Win=8192 Len=1000
   79 0.003322400 169.254.144.1 → 169.254.144.9 TCP 40 [TCP Dup ACK 9#35] 17998 → 19889 [ACK] Seq=1 Ack=2001 Win=63000 Len=0
   80 0.003335300 169.254.144.9 → 169.254.144.1 TCP 1040 19889 → 17998 [ACK] Seq=42001 Ack=1 Win=8192 Len=1000
   81 0.003337800 169.254.144.1 → 169.254.144.9 TCP 40 [TCP Dup ACK 9#36] 17998 → 19889 [ACK] Seq=1 Ack=2001 Win=63000 Len=0
   82 0.003346100 169.254.144.9 → 169.254.144.1 TCP 1040 19889 → 17998 [ACK] Seq=43001 Ack=1 Win=8192 Len=1000
   83 0.003347600 169.254.144.1 → 169.254.144.9 TCP 40 [TCP Dup ACK 9#37] 17998 → 19889 [ACK] Seq=1 Ack=2001 Win=63000 Len=0
   84 0.003353400 169.254.144.9 → 169.254.144.1 TCP 1040 19889 → 17998 [ACK] Seq=44001 Ack=1 Win=8192 Len=1000
   85 0.003354600 169.254.144.1 → 169.254.144.9 TCP 40 [TCP Dup ACK 9#38] 17998 → 19889 [ACK] Seq=1 Ack=2001 Win=63000 Len=0
   86 0.003360200 169.254.144.9 → 169.254.144.1 TCP 1040 19889 → 17998 [ACK] Seq=45001 Ack=1 Win=8192 Len=1000
   87 0.003361300 169.254.144.1 → 169.254.144.9 TCP 40 [TCP Dup ACK 9#39] 17998 → 19889 [ACK] Seq=1 Ack=2001 Win=63000 Len=0
   88 0.003367300 169.254.144.9 → 169.254.144.1 TCP 1040 [TCP Previous segment not captured] 19889 → 17998 [ACK] Seq=47001 Ack=1 Win=8192 Len=1000
   89 0.003368200 169.254.144.1 → 169.254.144.9 TCP 40 [TCP Dup ACK 9#40] 17998 → 19889 [ACK] Seq=1 Ack=2001 Win=63000 Len=0
   90 0.003374000 169.254.144.9 → 169.254.144.1 TCP 1040 19889 → 17998 [ACK] Seq=48001 Ack=1 Win=8192 Len=1000
   91 0.003374900 169.254.144.1 → 169.254.144.9 TCP 40 [TCP Dup ACK 9#41] 17998 → 19889 [ACK] Seq=1 Ack=2001 Win=63000 Len=0
   92 0.003380700 169.254.144.9 → 169.254.144.1 TCP 1040 19889 → 17998 [ACK] Seq=49001 Ack=1 Win=8192 Len=1000
   93 0.003381700 169.254.144.1 → 169.254.144.9 TCP 40 [TCP Dup ACK 9#42] 17998 → 19889 [ACK] Seq=1 Ack=2001 Win=63000 Len=0
   94 0.003386900 169.254.144.9 → 169.254.144.1 TCP 1040 19889 → 17998 [ACK] Seq=50001 Ack=1 Win=8192 Len=1000
   95 0.003387800 169.254.144.1 → 169.254.144.9 TCP 40 [TCP Dup ACK 9#43] 17998 → 19889 [ACK] Seq=1 Ack=2001 Win=63000 Len=0
   96 0.003393600 169.254.144.9 → 169.254.144.1 TCP 1040 19889 → 17998 [ACK] Seq=51001 Ack=1 Win=8192 Len=1000
   97 0.003394700 169.254.144.1 → 169.254.144.9 TCP 40 [TCP Dup ACK 9#44] 17998 → 19889 [ACK] Seq=1 Ack=2001 Win=63000 Len=0
   98 0.003400700 169.254.144.9 → 169.254.144.1 TCP 1040 19889 → 17998 [ACK] Seq=52001 Ack=1 Win=8192 Len=1000
   99 0.003401900 169.254.144.1 → 169.254.144.9 TCP 40 [TCP Dup ACK 9#45] 17998 → 19889 [ACK] Seq=1 Ack=2001 Win=63000 Len=0
  100 0.003407500 169.254.144.9 → 169.254.144.1 TCP 1040 19889 → 17998 [ACK] Seq=53001 Ack=1 Win=8192 Len=1000
  101 0.003409300 169.254.144.1 → 169.254.144.9 TCP 40 [TCP Dup ACK 9#46] 17998 → 19889 [ACK] Seq=1 Ack=2001 Win=63000 Len=0
  102 0.003414800 169.254.144.9 → 169.254.144.1 TCP 1040 19889 → 17998 [ACK] Seq=54001 Ack=1 Win=8192 Len=1000
  103 0.003416100 169.254.144.1 → 169.254.144.9 TCP 40 [TCP Dup ACK 9#47] 17998 → 19889 [ACK] Seq=1 Ack=2001 Win=63000 Len=0
  104 0.003421400 169.254.144.9 → 169.254.144.1 TCP 1040 19889 → 17998 [ACK] Seq=55001 Ack=1 Win=8192 Len=1000
  105 0.003422400 169.254.144.1 → 169.254.144.9 TCP 40 [TCP Dup ACK 9#48] 17998 → 19889 [ACK] Seq=1 Ack=2001 Win=63000 Len=0
  106 0.003427700 169.254.144.9 → 169.254.144.1 TCP 1040 19889 → 17998 [ACK] Seq=56001 Ack=1 Win=8192 Len=1000
  107 0.003428700 169.254.144.1 → 169.254.144.9 TCP 40 [TCP Dup ACK 9#49] 17998 → 19889 [ACK] Seq=1 Ack=2001 Win=63000 Len=0
  108 0.003433900 169.254.144.9 → 169.254.144.1 TCP 1040 19889 → 17998 [ACK] Seq=57001 Ack=1 Win=8192 Len=1000
  109 0.003434800 169.254.144.1 → 169.254.144.9 TCP 40 [TCP Dup ACK 9#50] 17998 → 19889 [ACK] Seq=1 Ack=2001 Win=63000 Len=0
  110 0.003440000 169.254.144.9 → 169.254.144.1 TCP 1040 19889 → 17998 [ACK] Seq=58001 Ack=1 Win=8192 Len=1000
  111 0.003440900 169.254.144.1 → 169.254.144.9 TCP 40 [TCP Dup ACK 9#51] 17998 → 19889 [ACK] Seq=1 Ack=2001 Win=63000 Len=0
  112 0.003446600 169.254.144.9 → 169.254.144.1 TCP 1040 19889 → 17998 [ACK] Seq=59001 Ack=1 Win=8192 Len=1000
  113 0.003447800 169.254.144.1 → 169.254.144.9 TCP 40 [TCP Dup ACK 9#52] 17998 → 19889 [ACK] Seq=1 Ack=2001 Win=63000 Len=0
  114 0.003453100 169.254.144.9 → 169.254.144.1 TCP 1040 19889 → 17998 [ACK] Seq=60001 Ack=1 Win=8192 Len=1000
  115 0.003454200 169.254.144.1 → 169.254.144.9 TCP 40 [TCP Dup ACK 9#53] 17998 → 19889 [ACK] Seq=1 Ack=2001 Win=63000 Len=0
  116 0.003459600 169.254.144.9 → 169.254.144.1 TCP 1040 19889 → 17998 [ACK] Seq=61001 Ack=1 Win=8192 Len=1000
  117 0.003460800 169.254.144.1 → 169.254.144.9 TCP 40 [TCP Dup ACK 9#54] 17998 → 19889 [ACK] Seq=1 Ack=2001 Win=63000 Len=0
  118 0.003466100 169.254.144.9 → 169.254.144.1 TCP 1040 19889 → 17998 [ACK] Seq=62001 Ack=1 Win=8192 Len=1000
  119 0.003467300 169.254.144.1 → 169.254.144.9 TCP 40 [TCP Dup ACK 9#55] 17998 → 19889 [ACK] Seq=1 Ack=2001 Win=63000 Len=0
  120 0.003472500 169.254.144.9 → 169.254.144.1 TCP 1040 19889 → 17998 [ACK] Seq=63001 Ack=1 Win=8192 Len=1000
  121 0.003473400 169.254.144.1 → 169.254.144.9 TCP 40 [TCP Dup ACK 9#56] 17998 → 19889 [ACK] Seq=1 Ack=2001 Win=63000 Len=0
  122 0.003609800 169.254.144.1 → 169.254.144.9 TCP 40 17998 → 19889 [FIN, ACK] Seq=1 Ack=2001 Win=63000 Len=0
  123 0.003643000 169.254.144.9 → 169.254.144.1 TCP 280 19889 → 17998 [ACK] Seq=64001 Ack=1 Win=8192 Len=240
  124 0.003646900 169.254.144.1 → 169.254.144.9 TCP 40 [TCP Dup ACK 9#57] 17998 → 19889 [ACK] Seq=2 Ack=2001 Win=63000 Len=0
  125 0.003719900 169.254.144.9 → 169.254.144.1 TCP 800 [TCP Window Full] 19889 → 17998 [ACK] Seq=64241 Ack=1 Win=8192 Len=760
  126 0.003723400 169.254.144.1 → 169.254.144.9 TCP 40 [TCP Dup ACK 9#58] 17998 → 19889 [ACK] Seq=2 Ack=2001 Win=63000 Len=0
  127 0.006458400 169.254.144.9 → 169.254.144.1 TCP 40 [TCP Previous segment not captured] 19889 → 17998 [ACK] Seq=1520339172 Ack=2 Win=8192 Len=0
  128 0.006461700 169.254.144.1 → 169.254.144.9 TCP 40 [TCP Dup ACK 9#59] 17998 → 19889 [ACK] Seq=2 Ack=2001 Win=63000 Len=0
  129 0.015394000 169.254.144.9 → 169.254.144.1 TCP 1040 19889 → 17998 [ACK] Seq=2001 Ack=1 Win=8192 Len=1000
  130 0.015409800 169.254.144.1 → 169.254.144.9 TCP 40 [TCP ACKed unseen segment] 17998 → 19889 [ACK] Seq=2 Ack=11001 Win=54000 Len=0
  131 0.024470900 169.254.144.1 → 169.254.144.9 TCP 40 [TCP ACKed unseen segment] [TCP Retransmission] 17998 → 19889 [FIN, ACK] Seq=1 Ack=11001 Win=54000 Len=0
  132 0.024591100 169.254.144.9 → 169.254.144.1 TCP 40 [TCP Previous segment not captured] 19889 → 17998 [ACK] Seq=1520339172 Ack=1 Win=8192 Len=0
  133 0.051393000 169.254.144.9 → 169.254.144.1 TCP 1040 19889 → 17998 [ACK] Seq=11001 Ack=1 Win=8192 Len=1000
  134 0.051411600 169.254.144.1 → 169.254.144.9 TCP 40 [TCP ACKed unseen segment] 17998 → 19889 [ACK] Seq=2 Ack=19001 Win=46000 Len=0
  135 0.063388500 169.254.144.9 → 169.254.144.1 TCP 1040 [TCP Previous segment not captured] 19889 → 17998 [ACK] Seq=19001 Ack=1 Win=8192 Len=1000
  136 0.063403600 169.254.144.1 → 169.254.144.9 TCP 40 [TCP ACKed unseen segment] 17998 → 19889 [ACK] Seq=2 Ack=20001 Win=45000 Len=0
  137 0.074448000 169.254.144.1 → 169.254.144.9 TCP 40 [TCP Retransmission] 17998 → 19889 [FIN, ACK] Seq=1 Ack=20001 Win=45000 Len=0
  138 0.074540700 169.254.144.9 → 169.254.144.1 TCP 40 [TCP Previous segment not captured] 19889 → 17998 [ACK] Seq=1520339172 Ack=1 Win=8192 Len=0
  139 0.075388000 169.254.144.9 → 169.254.144.1 TCP 1040 19889 → 17998 [ACK] Seq=20001 Ack=1 Win=8192 Len=1000
  140 0.075403600 169.254.144.1 → 169.254.144.9 TCP 40 [TCP ACKed unseen segment] 17998 → 19889 [ACK] Seq=2 Ack=28001 Win=37000 Len=0
  141 0.087386900 169.254.144.9 → 169.254.144.1 TCP 1040 [TCP Previous segment not captured] 19889 → 17998 [ACK] Seq=28001 Ack=1 Win=8192 Len=1000
  142 0.087403200 169.254.144.1 → 169.254.144.9 TCP 40 [TCP ACKed unseen segment] 17998 → 19889 [ACK] Seq=2 Ack=46001 Win=24000 Len=0
  143 0.087611000 169.254.144.9 → 169.254.144.1 TCP 1040 [TCP Previous segment not captured] 19889 → 17998 [ACK] Seq=65001 Ack=1 Win=8192 Len=1000
  144 0.087614900 169.254.144.1 → 169.254.144.9 TCP 40 [TCP Window Update] [TCP ACKed unseen segment] 17998 → 19889 [ACK] Seq=2 Ack=46001 Win=43000 Len=0
  145 0.087621500 169.254.144.9 → 169.254.144.1 TCP 1040 19889 → 17998 [ACK] Seq=66001 Ack=1 Win=8192 Len=1000
  146 0.087623300 169.254.144.1 → 169.254.144.9 TCP 40 [TCP Dup ACK 142#1] 17998 → 19889 [ACK] Seq=2 Ack=46001 Win=43000 Len=0
  147 0.087628800 169.254.144.9 → 169.254.144.1 TCP 1040 19889 → 17998 [ACK] Seq=67001 Ack=1 Win=8192 Len=1000
  148 0.087630200 169.254.144.1 → 169.254.144.9 TCP 40 [TCP Dup ACK 142#2] 17998 → 19889 [ACK] Seq=2 Ack=46001 Win=43000 Len=0
  149 0.087635700 169.254.144.9 → 169.254.144.1 TCP 1040 [TCP Previous segment not captured] 19889 → 17998 [ACK] Seq=69001 Ack=1 Win=8192 Len=1000
  150 0.087636700 169.254.144.1 → 169.254.144.9 TCP 40 [TCP Dup ACK 142#3] 17998 → 19889 [ACK] Seq=2 Ack=46001 Win=43000 Len=0
  151 0.088173400 169.254.144.9 → 169.254.144.1 TCP 1040 19889 → 17998 [ACK] Seq=70001 Ack=1 Win=8192 Len=1000
  152 0.088177100 169.254.144.1 → 169.254.144.9 TCP 40 [TCP Dup ACK 142#4] 17998 → 19889 [ACK] Seq=2 Ack=46001 Win=43000 Len=0
  153 0.088183700 169.254.144.9 → 169.254.144.1 TCP 1040 19889 → 17998 [ACK] Seq=71001 Ack=1 Win=8192 Len=1000
  154 0.088184900 169.254.144.1 → 169.254.144.9 TCP 40 [TCP Dup ACK 142#5] 17998 → 19889 [ACK] Seq=2 Ack=46001 Win=43000 Len=0
  155 0.088190400 169.254.144.9 → 169.254.144.1 TCP 1040 [TCP Previous segment not captured] 19889 → 17998 [ACK] Seq=73001 Ack=1 Win=8192 Len=1000
  156 0.088191400 169.254.144.1 → 169.254.144.9 TCP 40 [TCP Dup ACK 142#6] 17998 → 19889 [ACK] Seq=2 Ack=46001 Win=43000 Len=0
  157 0.088197400 169.254.144.9 → 169.254.144.1 TCP 1040 19889 → 17998 [ACK] Seq=74001 Ack=1 Win=8192 Len=1000
  158 0.088198300 169.254.144.1 → 169.254.144.9 TCP 40 [TCP Dup ACK 142#7] 17998 → 19889 [ACK] Seq=2 Ack=46001 Win=43000 Len=0
  159 0.088203900 169.254.144.9 → 169.254.144.1 TCP 1040 19889 → 17998 [ACK] Seq=75001 Ack=1 Win=8192 Len=1000
  160 0.088205300 169.254.144.1 → 169.254.144.9 TCP 40 [TCP Dup ACK 142#8] 17998 → 19889 [ACK] Seq=2 Ack=46001 Win=43000 Len=0
  161 0.088210800 169.254.144.9 → 169.254.144.1 TCP 1040 19889 → 17998 [ACK] Seq=76001 Ack=1 Win=8192 Len=1000
  162 0.088212000 169.254.144.1 → 169.254.144.9 TCP 40 [TCP Dup ACK 142#9] 17998 → 19889 [ACK] Seq=2 Ack=46001 Win=43000 Len=0
  163 0.088218100 169.254.144.9 → 169.254.144.1 TCP 1040 19889 → 17998 [ACK] Seq=77001 Ack=1 Win=8192 Len=1000
  164 0.088219200 169.254.144.1 → 169.254.144.9 TCP 40 [TCP Dup ACK 142#10] 17998 → 19889 [ACK] Seq=2 Ack=46001 Win=43000 Len=0
  165 0.088224800 169.254.144.9 → 169.254.144.1 TCP 1040 19889 → 17998 [ACK] Seq=78001 Ack=1 Win=8192 Len=1000
  166 0.088226000 169.254.144.1 → 169.254.144.9 TCP 40 [TCP Dup ACK 142#11] 17998 → 19889 [ACK] Seq=2 Ack=46001 Win=43000 Len=0
  167 0.088231400 169.254.144.9 → 169.254.144.1 TCP 1040 19889 → 17998 [ACK] Seq=79001 Ack=1 Win=8192 Len=1000
  168 0.088232700 169.254.144.1 → 169.254.144.9 TCP 40 [TCP Dup ACK 142#12] 17998 → 19889 [ACK] Seq=2 Ack=46001 Win=43000 Len=0
  169 0.088238700 169.254.144.9 → 169.254.144.1 TCP 1040 19889 → 17998 [ACK] Seq=80001 Ack=1 Win=8192 Len=1000
  170 0.088240100 169.254.144.1 → 169.254.144.9 TCP 40 [TCP Dup ACK 142#13] 17998 → 19889 [ACK] Seq=2 Ack=46001 Win=43000 Len=0
  171 0.088246000 169.254.144.9 → 169.254.144.1 TCP 1040 19889 → 17998 [ACK] Seq=81001 Ack=1 Win=8192 Len=1000
  172 0.088247100 169.254.144.1 → 169.254.144.9 TCP 40 [TCP Dup ACK 142#14] 17998 → 19889 [ACK] Seq=2 Ack=46001 Win=43000 Len=0
  173 0.088252500 169.254.144.9 → 169.254.144.1 TCP 1040 [TCP Previous segment not captured] 19889 → 17998 [ACK] Seq=83001 Ack=1 Win=8192 Len=1000
  174 0.088253400 169.254.144.1 → 169.254.144.9 TCP 40 [TCP Dup ACK 142#15] 17998 → 19889 [ACK] Seq=2 Ack=46001 Win=43000 Len=0
  175 0.088259300 169.254.144.9 → 169.254.144.1 TCP 1040 19889 → 17998 [ACK] Seq=84001 Ack=1 Win=8192 Len=1000
  176 0.088260600 169.254.144.1 → 169.254.144.9 TCP 40 [TCP Dup ACK 142#16] 17998 → 19889 [ACK] Seq=2 Ack=46001 Win=43000 Len=0
  177 0.088265900 169.254.144.9 → 169.254.144.1 TCP 1040 19889 → 17998 [ACK] Seq=85001 Ack=1 Win=8192 Len=1000
  178 0.088267100 169.254.144.1 → 169.254.144.9 TCP 40 [TCP Dup ACK 142#17] 17998 → 19889 [ACK] Seq=2 Ack=46001 Win=43000 Len=0
  179 0.088272400 169.254.144.9 → 169.254.144.1 TCP 1040 19889 → 17998 [ACK] Seq=86001 Ack=1 Win=8192 Len=1000
  180 0.088273600 169.254.144.1 → 169.254.144.9 TCP 40 [TCP Dup ACK 142#18] 17998 → 19889 [ACK] Seq=2 Ack=46001 Win=43000 Len=0
  181 0.088278800 169.254.144.9 → 169.254.144.1 TCP 1040 19889 → 17998 [ACK] Seq=87001 Ack=1 Win=8192 Len=1000
  182 0.088280000 169.254.144.1 → 169.254.144.9 TCP 40 [TCP Dup ACK 142#19] 17998 → 19889 [ACK] Seq=2 Ack=46001 Win=43000 Len=0
  183 0.099387200 169.254.144.9 → 169.254.144.1 TCP 1040 [TCP Fast Retransmission] 19889 → 17998 [ACK] Seq=46001 Ack=1 Win=8192 Len=1000
  184 0.099403300 169.254.144.1 → 169.254.144.9 TCP 40 17998 → 19889 [ACK] Seq=2 Ack=68001 Win=21000 Len=0
  185 0.099507800 169.254.144.1 → 169.254.144.9 TCP 40 [TCP Window Update] 17998 → 19889 [ACK] Seq=2 Ack=68001 Win=46000 Len=0
  186 0.100108400 169.254.144.9 → 169.254.144.1 TCP 1041 [TCP Previous segment not captured] 19889 → 17998 [ACK] Seq=89001 Ack=1 Win=8192 Len=1001
  187 0.100112200 169.254.144.1 → 169.254.144.9 TCP 40 [TCP Dup ACK 184#1] 17998 → 19889 [ACK] Seq=2 Ack=68001 Win=46000 Len=0
  188 0.100118800 169.254.144.9 → 169.254.144.1 TCP 1041 19889 → 17998 [ACK] Seq=90002 Ack=1 Win=8192 Len=1001
  189 0.100120100 169.254.144.1 → 169.254.144.9 TCP 40 [TCP Dup ACK 184#2] 17998 → 19889 [ACK] Seq=2 Ack=68001 Win=46000 Len=0
  190 0.100125600 169.254.144.9 → 169.254.144.1 TCP 1041 19889 → 17998 [ACK] Seq=91003 Ack=1 Win=8192 Len=1001
  191 0.100126700 169.254.144.1 → 169.254.144.9 TCP 40 [TCP Dup ACK 184#3] 17998 → 19889 [ACK] Seq=2 Ack=68001 Win=46000 Len=0
  192 0.100132100 169.254.144.9 → 169.254.144.1 TCP 1041 19889 → 17998 [ACK] Seq=92004 Ack=1 Win=8192 Len=1001
  193 0.100133100 169.254.144.1 → 169.254.144.9 TCP 40 [TCP Dup ACK 184#4] 17998 → 19889 [ACK] Seq=2 Ack=68001 Win=46000 Len=0
  194 0.100138500 169.254.144.9 → 169.254.144.1 TCP 1041 19889 → 17998 [ACK] Seq=93005 Ack=1 Win=8192 Len=1001
  195 0.100139700 169.254.144.1 → 169.254.144.9 TCP 40 [TCP Dup ACK 184#5] 17998 → 19889 [ACK] Seq=2 Ack=68001 Win=46000 Len=0
  196 0.100145100 169.254.144.9 → 169.254.144.1 TCP 1041 19889 → 17998 [ACK] Seq=94006 Ack=1 Win=8192 Len=1001
  197 0.100146100 169.254.144.1 → 169.254.144.9 TCP 40 [TCP Dup ACK 184#6] 17998 → 19889 [ACK] Seq=2 Ack=68001 Win=46000 Len=0
  198 0.100151500 169.254.144.9 → 169.254.144.1 TCP 1041 19889 → 17998 [ACK] Seq=95007 Ack=1 Win=8192 Len=1001
  199 0.100152500 169.254.144.1 → 169.254.144.9 TCP 40 [TCP Dup ACK 184#7] 17998 → 19889 [ACK] Seq=2 Ack=68001 Win=46000 Len=0
  200 0.100157900 169.254.144.9 → 169.254.144.1 TCP 1041 19889 → 17998 [ACK] Seq=96008 Ack=1 Win=8192 Len=1001
  201 0.100158800 169.254.144.1 → 169.254.144.9 TCP 40 [TCP Dup ACK 184#8] 17998 → 19889 [ACK] Seq=2 Ack=68001 Win=46000 Len=0
  202 0.100164300 169.254.144.9 → 169.254.144.1 TCP 1041 19889 → 17998 [ACK] Seq=97009 Ack=1 Win=8192 Len=1001
  203 0.100165500 169.254.144.1 → 169.254.144.9 TCP 40 [TCP Dup ACK 184#9] 17998 → 19889 [ACK] Seq=2 Ack=68001 Win=46000 Len=0
  204 0.100170900 169.254.144.9 → 169.254.144.1 TCP 1041 19889 → 17998 [ACK] Seq=98010 Ack=1 Win=8192 Len=1001
  205 0.100172100 169.254.144.1 → 169.254.144.9 TCP 40 [TCP Dup ACK 184#10] 17998 → 19889 [ACK] Seq=2 Ack=68001 Win=46000 Len=0
  206 0.100177500 169.254.144.9 → 169.254.144.1 TCP 1041 19889 → 17998 [ACK] Seq=99011 Ack=1 Win=8192 Len=1001
  207 0.100178600 169.254.144.1 → 169.254.144.9 TCP 40 [TCP Dup ACK 184#11] 17998 → 19889 [ACK] Seq=2 Ack=68001 Win=46000 Len=0
  208 0.100183900 169.254.144.9 → 169.254.144.1 TCP 1041 19889 → 17998 [ACK] Seq=100012 Ack=1 Win=8192 Len=1001
  209 0.100185100 169.254.144.1 → 169.254.144.9 TCP 40 [TCP Dup ACK 184#12] 17998 → 19889 [ACK] Seq=2 Ack=68001 Win=46000 Len=0
  210 0.100190500 169.254.144.9 → 169.254.144.1 TCP 1041 19889 → 17998 [ACK] Seq=101013 Ack=1 Win=8192 Len=1001
  211 0.100191600 169.254.144.1 → 169.254.144.9 TCP 40 [TCP Dup ACK 184#13] 17998 → 19889 [ACK] Seq=2 Ack=68001 Win=46000 Len=0
  212 0.100196900 169.254.144.9 → 169.254.144.1 TCP 1041 19889 → 17998 [ACK] Seq=102014 Ack=1 Win=8192 Len=1001
  213 0.100198000 169.254.144.1 → 169.254.144.9 TCP 40 [TCP Dup ACK 184#14] 17998 → 19889 [ACK] Seq=2 Ack=68001 Win=46000 Len=0
  214 0.100203600 169.254.144.9 → 169.254.144.1 TCP 1041 [TCP Previous segment not captured] 19889 → 17998 [ACK] Seq=104016 Ack=1 Win=8192 Len=1001
  215 0.100204600 169.254.144.1 → 169.254.144.9 TCP 40 [TCP Dup ACK 184#15] 17998 → 19889 [ACK] Seq=2 Ack=68001 Win=46000 Len=0
  216 0.100210000 169.254.144.9 → 169.254.144.1 TCP 1041 19889 → 17998 [ACK] Seq=105017 Ack=1 Win=8192 Len=1001
  217 0.100211000 169.254.144.1 → 169.254.144.9 TCP 40 [TCP Dup ACK 184#16] 17998 → 19889 [ACK] Seq=2 Ack=68001 Win=46000 Len=0
  218 0.100216500 169.254.144.9 → 169.254.144.1 TCP 1041 19889 → 17998 [ACK] Seq=106018 Ack=1 Win=8192 Len=1001
  219 0.100217900 169.254.144.1 → 169.254.144.9 TCP 40 [TCP Dup ACK 184#17] 17998 → 19889 [ACK] Seq=2 Ack=68001 Win=46000 Len=0
  220 0.100223400 169.254.144.9 → 169.254.144.1 TCP 1041 [TCP Previous segment not captured] 19889 → 17998 [ACK] Seq=108020 Ack=1 Win=8192 Len=1001
  221 0.100224600 169.254.144.1 → 169.254.144.9 TCP 40 [TCP Dup ACK 184#18] 17998 → 19889 [ACK] Seq=2 Ack=68001 Win=46000 Len=0
  222 0.100230200 169.254.144.9 → 169.254.144.1 TCP 1041 19889 → 17998 [ACK] Seq=109021 Ack=1 Win=8192 Len=1001
  223 0.100231300 169.254.144.1 → 169.254.144.9 TCP 40 [TCP Dup ACK 184#19] 17998 → 19889 [ACK] Seq=2 Ack=68001 Win=46000 Len=0
  224 0.100236700 169.254.144.9 → 169.254.144.1 TCP 1041 19889 → 17998 [ACK] Seq=110022 Ack=1 Win=8192 Len=1001
  225 0.100237900 169.254.144.1 → 169.254.144.9 TCP 40 [TCP Dup ACK 184#20] 17998 → 19889 [ACK] Seq=2 Ack=68001 Win=46000 Len=0
  226 0.100243400 169.254.144.9 → 169.254.144.1 TCP 1041 19889 → 17998 [ACK] Seq=111023 Ack=1 Win=8192 Len=1001
  227 0.100244300 169.254.144.1 → 169.254.144.9 TCP 40 [TCP Dup ACK 184#21] 17998 → 19889 [ACK] Seq=2 Ack=68001 Win=46000 Len=0
  228 0.100249800 169.254.144.9 → 169.254.144.1 TCP 1041 19889 → 17998 [ACK] Seq=112024 Ack=1 Win=8192 Len=1001
  229 0.100250700 169.254.144.1 → 169.254.144.9 TCP 40 [TCP Dup ACK 184#22] 17998 → 19889 [ACK] Seq=2 Ack=68001 Win=46000 Len=0
  230 0.100256000 169.254.144.9 → 169.254.144.1 TCP 1016 [TCP Window Full] 19889 → 17998 [ACK] Seq=113025 Ack=1 Win=8192 Len=976
  231 0.100256900 169.254.144.1 → 169.254.144.9 TCP 40 [TCP Dup ACK 184#23] 17998 → 19889 [ACK] Seq=2 Ack=68001 Win=46000 Len=0
  232 0.111387000 169.254.144.9 → 169.254.144.1 TCP 1040 [TCP Fast Retransmission] 19889 → 17998 [ACK] Seq=68001 Ack=1 Win=8192 Len=1000
  233 0.111402200 169.254.144.1 → 169.254.144.9 TCP 40 17998 → 19889 [ACK] Seq=2 Ack=72001 Win=42000 Len=0
  234 0.123388000 169.254.144.9 → 169.254.144.1 TCP 1040 [TCP Retransmission] 19889 → 17998 [ACK] Seq=72001 Ack=1 Win=8192 Len=1000
  235 0.123403200 169.254.144.1 → 169.254.144.9 TCP 40 17998 → 19889 [ACK] Seq=2 Ack=82001 Win=65535 Len=0
  236 0.123828600 169.254.144.9 → 169.254.144.1 TCP 1041 19889 → 17998 [ACK] Seq=114001 Ack=1 Win=8192 Len=1001
  237 0.123832500 169.254.144.1 → 169.254.144.9 TCP 40 [TCP Dup ACK 235#1] 17998 → 19889 [ACK] Seq=2 Ack=82001 Win=65535 Len=0
  238 0.123839100 169.254.144.9 → 169.254.144.1 TCP 1041 19889 → 17998 [ACK] Seq=115002 Ack=1 Win=8192 Len=1001
  239 0.123840300 169.254.144.1 → 169.254.144.9 TCP 40 [TCP Dup ACK 235#2] 17998 → 19889 [ACK] Seq=2 Ack=82001 Win=65535 Len=0
  240 0.123845800 169.254.144.9 → 169.254.144.1 TCP 1041 19889 → 17998 [ACK] Seq=116003 Ack=1 Win=8192 Len=1001
  241 0.123846800 169.254.144.1 → 169.254.144.9 TCP 40 [TCP Dup ACK 235#3] 17998 → 19889 [ACK] Seq=2 Ack=82001 Win=65535 Len=0
  242 0.123852400 169.254.144.9 → 169.254.144.1 TCP 1041 19889 → 17998 [ACK] Seq=117004 Ack=1 Win=8192 Len=1001
  243 0.123853400 169.254.144.1 → 169.254.144.9 TCP 40 [TCP Dup ACK 235#4] 17998 → 19889 [ACK] Seq=2 Ack=82001 Win=65535 Len=0
  244 0.123858900 169.254.144.9 → 169.254.144.1 TCP 1041 19889 → 17998 [ACK] Seq=118005 Ack=1 Win=8192 Len=1001
  245 0.123860200 169.254.144.1 → 169.254.144.9 TCP 40 [TCP Dup ACK 235#5] 17998 → 19889 [ACK] Seq=2 Ack=82001 Win=65535 Len=0
  246 0.123865600 169.254.144.9 → 169.254.144.1 TCP 1041 19889 → 17998 [ACK] Seq=119006 Ack=1 Win=8192 Len=1001
  247 0.123866500 169.254.144.1 → 169.254.144.9 TCP 40 [TCP Dup ACK 235#6] 17998 → 19889 [ACK] Seq=2 Ack=82001 Win=65535 Len=0
  248 0.123872700 169.254.144.9 → 169.254.144.1 TCP 1041 19889 → 17998 [ACK] Seq=120007 Ack=1 Win=8192 Len=1001
  249 0.123873600 169.254.144.1 → 169.254.144.9 TCP 40 [TCP Dup ACK 235#7] 17998 → 19889 [ACK] Seq=2 Ack=82001 Win=65535 Len=0
  250 0.123879000 169.254.144.9 → 169.254.144.1 TCP 1041 19889 → 17998 [ACK] Seq=121008 Ack=1 Win=8192 Len=1001
  251 0.123880000 169.254.144.1 → 169.254.144.9 TCP 40 [TCP Dup ACK 235#8] 17998 → 19889 [ACK] Seq=2 Ack=82001 Win=65535 Len=0
  252 0.123885500 169.254.144.9 → 169.254.144.1 TCP 1041 19889 → 17998 [ACK] Seq=122009 Ack=1 Win=8192 Len=1001
  253 0.123886800 169.254.144.1 → 169.254.144.9 TCP 40 [TCP Dup ACK 235#9] 17998 → 19889 [ACK] Seq=2 Ack=82001 Win=65535 Len=0
  254 0.123892800 169.254.144.9 → 169.254.144.1 TCP 1041 19889 → 17998 [ACK] Seq=123010 Ack=1 Win=8192 Len=1001
  255 0.123894000 169.254.144.1 → 169.254.144.9 TCP 40 [TCP Dup ACK 235#10] 17998 → 19889 [ACK] Seq=2 Ack=82001 Win=65535 Len=0
  256 0.123900000 169.254.144.9 → 169.254.144.1 TCP 1041 19889 → 17998 [ACK] Seq=124011 Ack=1 Win=8192 Len=1001
  257 0.123901200 169.254.144.1 → 169.254.144.9 TCP 40 [TCP Dup ACK 235#11] 17998 → 19889 [ACK] Seq=2 Ack=82001 Win=65535 Len=0
  258 0.123906700 169.254.144.9 → 169.254.144.1 TCP 1041 19889 → 17998 [ACK] Seq=125012 Ack=1 Win=8192 Len=1001
  259 0.123907800 169.254.144.1 → 169.254.144.9 TCP 40 [TCP Dup ACK 235#12] 17998 → 19889 [ACK] Seq=2 Ack=82001 Win=65535 Len=0
  260 0.123913700 169.254.144.9 → 169.254.144.1 TCP 1041 19889 → 17998 [ACK] Seq=126013 Ack=1 Win=8192 Len=1001
  261 0.123914700 169.254.144.1 → 169.254.144.9 TCP 40 [TCP Dup ACK 235#13] 17998 → 19889 [ACK] Seq=2 Ack=82001 Win=65535 Len=0
  262 0.123920500 169.254.144.9 → 169.254.144.1 TCP 1041 19889 → 17998 [ACK] Seq=127014 Ack=1 Win=8192 Len=1001
  263 0.123921500 169.254.144.1 → 169.254.144.9 TCP 40 [TCP Dup ACK 235#14] 17998 → 19889 [ACK] Seq=2 Ack=82001 Win=65535 Len=0
  264 0.123927700 169.254.144.9 → 169.254.144.1 TCP 1041 19889 → 17998 [ACK] Seq=128015 Ack=1 Win=8192 Len=1001
  265 0.123928700 169.254.144.1 → 169.254.144.9 TCP 40 [TCP Dup ACK 235#15] 17998 → 19889 [ACK] Seq=2 Ack=82001 Win=65535 Len=0
  266 0.123934000 169.254.144.9 → 169.254.144.1 TCP 1041 19889 → 17998 [ACK] Seq=129016 Ack=1 Win=8192 Len=1001
  267 0.123935100 169.254.144.1 → 169.254.144.9 TCP 40 [TCP Dup ACK 235#16] 17998 → 19889 [ACK] Seq=2 Ack=82001 Win=65535 Len=0
  268 0.123941100 169.254.144.9 → 169.254.144.1 TCP 1041 19889 → 17998 [ACK] Seq=130017 Ack=1 Win=8192 Len=1001
  269 0.123942300 169.254.144.1 → 169.254.144.9 TCP 40 [TCP Dup ACK 235#17] 17998 → 19889 [ACK] Seq=2 Ack=82001 Win=65535 Len=0
  270 0.123945400 169.254.144.9 → 169.254.144.1 TCP 95 19889 → 17998 [FIN, ACK] Seq=131018 Ack=1 Win=8192 Len=55
  271 0.123946700 169.254.144.1 → 169.254.144.9 TCP 40 [TCP Dup ACK 235#18] 17998 → 19889 [ACK] Seq=2 Ack=82001 Win=65535 Len=0
  272 0.159387200 169.254.144.9 → 169.254.144.1 TCP 1040 [TCP Retransmission] 19889 → 17998 [ACK] Seq=82001 Ack=1 Win=8192 Len=1000
  273 0.159402600 169.254.144.1 → 169.254.144.9 TCP 40 17998 → 19889 [ACK] Seq=2 Ack=88001 Win=65535 Len=0
  274 0.164469100 169.254.144.1 → 169.254.144.9 TCP 40 [TCP Retransmission] 17998 → 19889 [FIN, ACK] Seq=1 Ack=88001 Win=65535 Len=0
  275 0.164549900 169.254.144.9 → 169.254.144.1 TCP 40 [TCP Previous segment not captured] 19889 → 17998 [ACK] Seq=1520339172 Ack=1 Win=8192 Len=0
  276 0.171386600 169.254.144.9 → 169.254.144.1 TCP 1040 19889 → 17998 [ACK] Seq=88001 Ack=1 Win=8192 Len=1000
  277 0.171401800 169.254.144.1 → 169.254.144.9 TCP 40 17998 → 19889 [ACK] Seq=2 Ack=103015 Win=65535 Len=0
  278 0.183386100 169.254.144.9 → 169.254.144.1 TCP 1041 [TCP Previous segment not captured] 19889 → 17998 [ACK] Seq=103015 Ack=1 Win=8192 Len=1001
  279 0.183400700 169.254.144.1 → 169.254.144.9 TCP 40 17998 → 19889 [ACK] Seq=2 Ack=107019 Win=65535 Len=0
  280 0.195386600 169.254.144.9 → 169.254.144.1 TCP 1041 [TCP Previous segment not captured] 19889 → 17998 [ACK] Seq=107019 Ack=1 Win=8192 Len=1001
  281 0.195391300 169.254.144.1 → 169.254.144.9 TCP 40 17998 → 19889 [ACK] Seq=2 Ack=131074 Win=65535 Len=0
  282 0.334960500 169.254.144.1 → 169.254.144.9 TCP 40 [TCP Retransmission] 17998 → 19889 [FIN, ACK] Seq=1 Ack=131074 Win=65535 Len=0
  283 0.664519200 169.254.144.1 → 169.254.144.9 TCP 40 [TCP Retransmission] 17998 → 19889 [FIN, ACK] Seq=1 Ack=131074 Win=65535 Len=0
